"Nr Zona";"Cod Processual Res nº 65/CNJ";"Endereço";"CEP";"Bairro";"Município Sede";"UF";
"1";"15-0001";"RUA ODON BEZERRA, 309";"58020500";"TAMBIÁ";"JOÃO PESSOA";"PB"
"2";"15-0002";"RUA MARIA DE LOURDES SEREJO, S/N";"58300660";"ALTO DOS EUCALIPTOS";"SANTA RITA";"PB"
"3";"15-0003";"RUA CESÁR CARTAXO,117";"58337000";"CENTRO";"CRUZ DO ESPÍRITO SANTO";"PB"
"4";"15-0004";"RUA PADRE ZEFERINO MARIA, S/N, CENTRO";"58340000";"CENTRO";"SAPÉ";"PB"
"5";"15-0005";"PRAÇA 31 DE MARÇO, S/N (FORUM)";"58338000";"CENTRO";"PILAR";"PB"
"6";"15-0006";"PRAÇA EPITACIO PESSOA, 02, CENTRO";"58360000";"CENTRO";"ITABAIANA";"PB"
"7";"15-0007";"RUA  PRESIDENTE KENNEDY, S/N - BR 101";"58280000";"CENTRO";"MAMANGUAPE";"PB"
"8";"15-0008";"RUA PREFEITO FRANCISCO LUCAS DE SOUZA RANGEL";"58380000";"JARDIM FARIAS";"INGÁ";"PB"
"9";"15-0009";"RUA CÔNEGO FIRMINO CAVALCANTE, 920 - CENTRO";"58388000";"CENTRO";"ALAGOA GRANDE";"PB"
"10";"15-0010";"RUA ALMEIDA BARRETO, 39";"58200000";"CENTRO";"GUARABIRA";"PB"
"11";"15-0011";"PRAÇA DO TRABALHO, SN";"58397000";"JUSSARA";"AREIA";"PB"
"12";"15-0012";"RUA MONSENHOR WALFREDO, 33";"58395000";"CENTRO";"SERRARIA";"PB"
"13";"15-0013";"RUA JOÃO PESSOA , 168";"58125000";"CENTRO";"ALAGOA NOVA";"PB"
"14";"15-0014";"RUA ADJALMA EPITÁCIO, S/N";"58220000";"CONJUNTO MAJOR AUGUSTO BEZERRA";"BANANEIRAS";"PB"
"15";"15-0015";"RUA ANTENOR NAVARRO, S/N";"58253000";"CENTRO";"CAIÇARA";"PB"
"16";"15-0016";"RUA RIO GRANDE DO SUL S/N - COMPLEXO JUDICIARIO";"58414025";"LIBERDADE";"CAMPINA GRANDE";"PB"
"17";"15-0017";"RUA RIO GRANDE DO SUL, S/N";"58414025";"LIBERDADE";"CAMPINA GRANDE";"PB"
"18";"15-0018";"PRAÇA JOÃO PESSOA, 25 - TÉRREO";"58497000";"CENTRO";"UMBUZEIRO";"PB"
"19";"15-0019";"RUA CÍCERO GALDINO SOBRINHO, 56";"58135000";"CENTRO";"ESPERANÇA";"PB"
"20";"15-0020";"RUA LUIZ TARGINO MOREIRA, S/N,";"58233000";"CENTRO";"ARARUNA";"PB"
"21";"15-0021";"R. PADRE INACIO CAVALCANTE DE ALBUQUERQUE, N 379";"58480000";"CENTRO";"CABACEIRAS";"PB"
"22";"15-0022";"RUA LOURIVAL RAMOS, S/N";"58590000";"CENTRO";"SÃO JOÃO DO CARIRI";"PB"
"23";"15-0023";"RUA VENÂNCIO MARTINS SAMPAIO, S/N (FÓRUM)";"58155000";"JARDIM CRUZEIRO";"SOLEDADE";"PB"
"24";"15-0024";"RUA SAMUEL FURTADO, S/N";"58175000";"CENTRO";"CUITÉ";"PB"
"25";"15-0025";"RUA OTÁVIO HENRIQUES, 41";"58187000";"CENTRO";"PICUÍ";"PB"
"26";"15-0026";"FÓRUM ELEITORAL DES. LUIZ SILVIO RAMALHO - RUA BONIFÁCIO NÓBREGA, S/N";"58600000";"BAIRRO SAO JOSE";"SANTA LUZIA";"PB"
"27";"15-0027";"RUA SOLON DE LUCENA, S/N";"58680000";"BAIRRO DO ALTO";"TAPEROÁ";"PB"
"28";"15-0028";"RUA VIDAL DE NEGREIROS, 200";"58700330";"CENTRO";"PATOS";"PB"
"29";"15-0029";"RUA CAPITÃO ANTÔNIO VICENTE, N 11";"58500000";"CENTRO";"MONTEIRO";"PB"
"30";"15-0030";"RUA TEN. MANOEL DE OLIVEIRA LIRA, S/N";"58735000";"CENTRO";"TEIXEIRA";"PB"
"31";"15-0031";"RUA PROFESSORA MARIA CLAUDETE BANDEIRA DE SOUSA, 307";"58840000";"PETROPOLIS";"POMBAL";"PB"
"32";"15-0032";"RUA VIRGILIO DE ARAÚJO SILVA, SN";"58765000";"JARDIM OURO BRANCO";"PIANCÓ";"PB"
"33";"15-0033";"RUA FELINTO EVANGELISTA PRIMO, S/N,  ANEXO AO FÓRUM LOCAL";"58780000";"LOTEAMENTO JOAO SILVINO";"ITAPORANGA";"PB"
"34";"15-0034";"RUA SAO ROQUE, 210, CENTRO";"58755000";"CENTRO";"PRINCESA ISABEL";"PB"
"35";"15-0035";"FÓRUM ELEITORAL DES. WALTER SARMENTO DE SÁ - RUA HAROLDO NAZARETH, SN";"58804718";"RACHEL GADELHA";"SOUSA";"PB"
"36";"15-0036";"AV. DEP. AMÉRICO MAIA, S/N";"58884000";"JOÃO SERAFIM";"CATOLÉ DO ROCHA";"PB"
"37";"15-0037";"RUA PROJETADA";"58910000";"BAIRRO DAS POPULARES";"SÃO JOÃO DO RIO DO PEIXE";"PB"
"38";"15-0038";"RUA PADRE AYRES, S/N.";"58890000";"CENTRO";"BREJO DO CRUZ";"PB"
"39";"15-0039";"RUA MAE UMBELINA, 180 - TÉRREO - CENTRO - BONITO DE SANTA FÉ/PB";"58960000";"CENTRO";"BONITO DE SANTA FÉ";"PB"
"40";"15-0040";"RODOVIA PB 400, N 251 - PERIMETRO URBANO";"58940000";"CENTRO";"SÃO JOSÉ DE PIRANHAS";"PB"
"41";"15-0041";"RUA ANTONIO GONZAGA S/N";"58970000";"CENTRO";"CONCEIÇÃO";"PB"
"42";"15-0042";"RUA VALDENEZ PEREIRA DE SOUZA S/N - ANEXO AO FORUM FERREIRA JUNIOR";"58900000";"CENTRO";"CAJAZEIRAS";"PB"
"43";"15-0043";"RUA ANTONIO BATISTA GONÇALVES - 281";"58540000";"CENTRO";"SUMÉ";"PB"
"44";"15-0044";"RUA FERNANDO CABRAL, S/N";"58328000";"CENTRO";"PEDRAS DE FOGO";"PB"
"45";"15-0045";"RUA NORBERTO BARACUHY, 258";"58393000";"CENTRO";"PILÕES";"PB"
"46";"15-0046";"RUA MARIA CÂNDIDA DE SENA, S/N";"58390000";"CENTRO";"ALAGOINHA";"PB"
"47";"15-0047";"RODOVIA PB 055 - LOTEAMENTO OLIVEIRO PEREIRA DE LUCENA";"58213000";"CENTRO";"PIRPIRITUBA";"PB"
"48";"15-0048";"RUA CÂNDIDO DE SOUZA, 87";"58225000";"CENTRO";"SOLÂNEA";"PB"
"49";"15-0049";"RUA PADRE LEONEL FRANCA, N. 150";"58489000";"CENTRO";"AROEIRAS";"PB"
"50";"15-0050";"RUA PROFESSOR JOÃO RODRIGUES, S/N";"58150000";"CENTRO";"POCINHOS";"PB"
"51";"15-0051";"RUA MONSENHOR VALERIANO PEREIRA";"58713000";"CENTRO";"MALTA";"PB"
"52";"15-0052";"RUA JOÃO FERNANDES DE LIMA, S/N";"58770000";"POMBALZINHO";"COREMAS";"PB"
"53";"15-0053";"RUA POETA FRANCISCO EVARISTO, S/N";"58915000";"RETIRO I";"UIRAÚNA";"PB"
"54";"15-0054";"RODOVIA PB 055, KM 74";"58255000";"BELEM";"BELÉM";"PB"
"55";"15-0055";"RUA TENENTE JOSÉ DE FRANCA S/N";"58297000";"CENTRO";"RIO TINTO";"PB"
"56";"15-0056";"PRAÇA JOÃO PESSOA, S/N (FÓRUM)";"58660000";"CENTRO";"JUAZEIRINHO";"PB"
"57";"15-0057";"BR 230 KM 01- B";"58310000";"CENTRO";"CABEDELO";"PB"
"58";"15-0058";"RUA RAUL DA COSTA LEAO,122";"58580000";"CENTRO";"SERRA BRANCA";"PB"
"59";"15-0059";"RUA EUNICE RIBEIRO 372 TÉRREO";"58475000";"CENTRO";"QUEIMADAS";"PB"
"60";"15-0060";"RUA PRESIDENTE JOAO PESSOA, S/N,CENTRO";"58278000";"CENTRO";"JACARAÚ";"PB"
"61";"15-0061";"AV. LIBERDADE, 3423";"58306000";"CENTRO";"BAYEUX";"PB"
"62";"15-0062";"AV. NOSSA SENHORA DO DESTERRO, 1040";"58450000";"BAIRRO NOVO";"BOQUEIRÃO";"PB"
"63";"15-0063";"RUA HAROLDO NAZARETH, S/N";"58802185";"GATO PRETO";"SOUSA";"PB"
"64";"15-0064";"RUA ODON BEZERRA, 309";"58020500";"TAMBIÁ";"JOÃO PESSOA";"PB"
"65";"15-0065";"RUA JOÃO BOSCO DE ARAÚJO, 200";"58700330";"JARDIM CALIFÓRNIA";"PATOS";"PB"
"66";"15-0066";"RUA VIRGILIO DE ARAÚJO SILVA, SN";"58765000";"JARDIM OURO BRANCO";"PIANCÓ";"PB"
"67";"15-0067";"RUA JULITA GARCIA SERAFIM, SN";"58398000";"CENTRO";"REMÍGIO";"PB"
"68";"15-0068";"AV. COMANDANTE VITAL ROLIM, S/N (ANEXO AO FÓRUM)";"58900000";"CENTRO";"CAJAZEIRAS";"PB"
"69";"15-0069";"RUA MANOEL HERCULANO DA CRUZ N 466";"58865000";"CENTRO";"SÃO BENTO";"PB"
"70";"15-0070";"RUA ODON BEZERRA, 309";"58020500";"TAMBIÁ";"JOÃO PESSOA";"PB"
"71";"15-0071";"RUA RIO GRANDE DO SUL, S/N";"58414025";"LIBERDADE";"CAMPINA GRANDE";"PB"
"72";"15-0072";"AV. RIO GRANDE DO SUL, S/N -";"58105430";"LIBERDADE";"CAMPINA GRANDE";"PB"
"73";"15-0073";"RUA PRES. JOAO PESSOA S/N (ANEXO FORUM)";"58320000";"CENTRO";"ALHANDRA";"PB"
"74";"15-0074";"RUA VICENTE NERI,  78";"58550000";"CENTRO";"PRATA";"PB"
"75";"15-0075";"RUA SETE DE SETEMBRO S/N";"58356000";"CENTRO";"GURINHÉM";"PB"
"76";"15-0076";"RUA ODON BEZERRA, 309";"58020500";"TAMBIÁ";"JOÃO PESSOA";"PB"
"77";"15-0077";"RUA ODON BEZERRA, 309";"58020500";"TAMBIÁ";"JOÃO PESSOA";"PB"
